部分,考试类型,问题类型,问答对,三元组
研考成考,成人高考,报名篇,"问：在上海参加成人高考报名条件是什么？有户籍或学历要求吗？答：（以当年公布的文件为准）2023年报名条件是：（1）遵守中华人民共和国宪法和法律；（2）国家承认学历的各类高、中等学校在校生以外的从业人员和社会其他人员；（3）身体健康，生活能自理，不影响所报专业学习；（4）报考高起本或高起专的考生必须是高级中等教育学校毕业或者具有同等学力。报考专升本的考生必须是已取得经教育部审定核准的国民教育系列高等学校、高等教育自学考试机构颁发的专科毕业证书、本科结业证书或以上证书的人员；（5）2024年春季本市成人高校毕业生（须提交就读学校证明）；（6）本市常住户口、在本市工作的非本市常住户口人员；（7）报考医学门类专业的考生应具备以下条件：①报考临床医学、口腔医学、预防医学、中医学等临床类专业的人员，应当取得省级卫生行政部门颁发的相应类别的执业助理医师及以上资格证书，或取得国家认可的普通中专相应专业学历，或者区县级及以上卫生行政部门颁发的乡村医生执业证书并具有中专学历或中专水平证书；②报考护理学专业的人员应当取得省级卫生行政部门颁发的执业护士证书；③报考医学门类其他专业的人员应当是从事卫生、医药行业工作的在职专业技术人员；④考生报考的专业,原则上应与所从事的专业对口。","['（上海，所在地，成人高考）', '（成人高考，具有，报名条件）', '（报名条件，包含，户籍要求）', '（报名条件，包含，学历要求）', '（高起本，报考条件，高级中等教育学校毕业）', '（高起本，报考条件，同等学力）', '（高起专，报考条件，高级中等教育学校毕业）', '（高起专，报考条件，同等学力）', '（专升本，报考条件，专科毕业证书）', '（专升本，报考条件，本科结业证书）', '（高等教育自学考试机构，颁发，专科毕业证书）', '（教育部，审定核准，国民教育系列高等学校）', '（医学门类专业，包括，临床医学）', '（医学门类专业，包括，口腔医学）', '（医学门类专业，包括，预防医学）', '（医学门类专业，包括，中医学）', '（临床医学，报考条件，执业助理医师资格证书）', '（临床医学，报考条件，中专学历）', '（护理学专业，报考条件，执业护士证书）', '（区县级及以上卫生行政部门，颁发，乡村医生执业证书）', '（专业对口，关联，医学门类专业）']"
研考成考,成人高考,报名篇,问：上海有哪些成人高考招生院校？开设哪些专业？答：招生院校和招生专业请查看“上海招考热线”网站（www.shmeea.edu.cn）首页—研考成考—成人高校招生考试栏目发布的“20XX年上海市成人高校招生专业目录”。注：2023年高起本：https://www.shmeea.edu.cn/download/20230829/201.pdf；2023年高起专：https://www.shmeea.edu.cn/download/20230829/202.pdf；2023年专升本：https://www.shmeea.edu.cn/download/20230829/203.pdf,[]
研考成考,成人高考,报名篇,问：成人高考招生院校地址和电话联系方式？答：考生可查看“上海招考热线”网站（www.shmeea.edu.cn）首页—研考成考—成人高校招生考试栏目发布的“20XX年上海市成人高校招生考试报名公告 ”附件《20XX年上海市成人高校招生考试报名咨询电话一览表》,"['（上海招考热线，拥有，www.shmeea.edu.cn）', '（上海招考热线，发布，20XX年上海市成人高校招生考试报名公告）', '（20XX年上海市成人高校招生考试报名公告，包含附件，20XX年上海市成人高校招生考试报名咨询电话一览表）', '（研考成考，包含，成人高考）', '（成人高考，包含，报名篇）']"
研考成考,成人高考,报名篇,问：成人高考报名一般安排在什么时间？答：考生可查看“上海招考热线”网站（www.shmeea.edu.cn）首页—研考成考—成人高校招生考试栏目发布的“20XX年上海市成人高校招生考试报名公告 ”注：2023年成人高考报名时间9月2日至9月6日每天9:00至22:00、9月7日9:00至12:00。,"['（上海招考热线，拥有网址，www.shmeea.edu.cn）', '（上海招考热线，包含栏目，研考成考）', '（研考成考，包含子栏目，成人高校招生考试栏目）', '（成人高校招生考试栏目，发布，20XX年上海市成人高校招生考试报名公告）', '（2023年成人高考报名时间，包含日期，9月2日）', '（2023年成人高考报名时间，包含日期，9月6日）', '（2023年成人高考报名时间，包含日期，9月7日）', '（9月2日，开始时间，9:00）', '（9月2日，结束时间，22:00）', '（9月6日，开始时间，9:00）', '（9月6日，结束时间，22:00）', '（9月7日，结束时间，12:00）', '（成人高考，属于，研考成考）', '（报名篇，属于，成人高考）']"
研考成考,成人高考,报名篇,问：成人高考报名通过什么方式报名？答：考生在规定时间登录“上海招考热线”网站（www.shmeea.edu.cn），点击首页“考试报名”栏目进入“2023年上海市成人高校招生考试报名”页面，按系统说明在网上填写基本信息，填报“意向志愿”和签署《2023年上海市成人高校招生考试网上报名协议条款》《上海市考生诚信考试承诺书》，报考专升本的考生须签署《专升本考生告知书》《专升本考生承诺书》，非本市常住户口的考生还须签署《非本市户籍考生承诺书》，并按要求上传所需报名材料。申请政策照顾性加分或免试的考生须上传相应照顾类型或免试的证明材料和本人身份证件。凡报考艺术类专业，必须为第一志愿，否则该志愿无效。,"['（上海招考热线网站，包含，考试报名）', '（考试报名，跳转至，2023年上海市成人高校招生考试报名页面）', '（考生，签署，网上报名协议条款）', '（考生，签署，考生诚信考试承诺书）', '（专升本考生告知书，关联，专升本考生承诺书）', '（非本市户籍考生承诺书，针对，非本市户籍考生）', '（政策照顾性加分，需提供，证明材料）', '（免试，需提供，证明材料）', '（政策照顾性加分，需提供，身份证件）', '（免试，需提供，身份证件）', '（艺术类专业，要求，第一志愿）']"
研考成考,成人高考,报名篇,问：报名后收到审核不通过的短信，是否要重新报名？答：考生提交材料由第一志愿院校进行审核，考生在此期间需实时关注资格审核情况，若审核不通过，须按院校要求重新网上提交材料并等待再次审核。注：2023年成人高考审核时间是在9月2日至9月9日。,"['（成人高考，属于，研考成考）', '（报名篇，属于，成人高考）', '（考生提交材料，提交至，第一志愿院校）', '（资格审核情况，被关注，考生）', '（审核不通过，触发，重新网上提交材料）', '（2023年成人高考审核时间，包含时间段，9月2日至9月9日）']"
研考成考,成人高考,报名篇,问：收到第一志愿的院校通知，让我携带材料去现场进行材料比对，成考报名必须要现场提交材料？答：报名期间网上提交过报考信息的考生，若人证比对不通过，则需至报考的第一志愿院校进行复核，逾期不再办理。注：2023年成人高考现场人证比对时间是在9月8日至9月9日每天8:30-16:30。,"['（成人高考，属于，研考成考）', '（报名篇，属于，成人高考）', '（成考报名，属于，报名篇）', '（考生，提交，报考信息）', '（人证比对，发生地点，现场）', '（材料比对，发生地点，现场）', '（2023年成人高考，现场人证比对时间，9月8日至9月9日每天8:30-16:30）', '（复核，执行机构，第一志愿院校）']"
研考成考,成人高考,报名篇,问：成人高考什么时候缴费？在哪里缴费？答：网上报名信息提交成功并通过审核的考生于规定时间，登录“上海招考热线”网站（www.shmeea.edu.cn）进行缴费，若未按时完成缴费则报名无效。注：2023年成人高考缴费时间是在9月11日至9月12日每天 9:00-22:00。,"['（成人高考，属于，研考成考）', '（报名篇，属于，成人高考）', '（问答对，关于，报名篇）', '（考生，进行，网上报名）', '（考生，通过，审核）', '（考生，登录，上海招考热线）', '（缴费，缴费时间，2023年成人高考缴费时间）', '（上海招考热线，是，网站）', '（上海招考热线，网址，www.shmeea.edu.cn）', '（2023年成人高考缴费时间，具体时间，9月11日至9月12日每天9:00-22:00）']"
研考成考,成人高考,报名篇,问：成人高考有补报名吗？答：没有补报名。,"['（研考成考，包含，成人高考）', '（成人高考，包含，报名篇）']"
研考成考,成人高考,考试篇,问：成人高考教材和考纲信息从哪里获取？答：考生可查看教育部教育考试院（原教育部考试中心）“中国教育考试网”（www.neea.edu.cn）—考试项目—成人高考—发布的《全国各类成人高等学校招生复习考试大纲（2020年版）》，如有更新以最新版为准。,"['（教育部教育考试院，原名，教育部考试中心）', '（中国教育考试网，隶属于，教育部教育考试院）', '（www.neea.edu.cn，是网址，中国教育考试网）', '（考试项目，属于，中国教育考试网）', '（成人高考，属于，考试项目）', '（教育部教育考试院，发布，《全国各类成人高等学校招生复习考试大纲（2020年版）》）', '（成人高考，使用，《全国各类成人高等学校招生复习考试大纲（2020年版）》）']"
研考成考,成人高考,考试篇,问：成人高考的考试时间？答：考试时间由国家统一安排，一般在每年10月。以下是2023年成考时间：,[]
研考成考,成人高考,考试篇,问：成人高考的考试科目？答：成考根据选择的学习层次和专业类分别有相关考试。（1）高起本统考科目理科类：语文、数学（理科）、外语、理化（物理、化学综合）。文科类：语文、数学（文科）、外语、史地（历史、地理综合）。（2）高起专统考科目理科类：语文、数学（理科）、外语。文科类：语文、数学（文科）、外语。外语设英语、日语两个语种，考生根据招生院校对语种的要求选择一种。艺术类、体育类专业招生必须进行专业加试，招生院校专业加试科目和考试时间必须在招生简章中注明并自行组织命题和考试。（3）专升本统考科目专升本统考科目为两门公共课和一门专业基础课，公共课科目为政治、外语。根据专业所隶属的学科门类共分为八个科类，公共课和专业基础课考试科目如下：①哲学、文学、历史学及中医、中药学类：政治、外语、大学语文。②艺术类：政治、外语、艺术概论。③工学、理学类：政治、外语、高等数学（一）。④经济学、管理学及药学类：政治、外语、高等数学（二）。⑤法学类：政治、外语、民法。⑥教育学：政治、外语、教育理论。⑦农学类：政治、外语、生态学基础。⑧医学类：政治、外语、医学综合。除统考科目外，是否再加试专业科目，由招生院校自行确定。如需加试专业科目，由招生院校提前向社会公布并自行组织命题和考试。注：以当年公布文件为准。,"['（高起本，包含科目，语文）', '（高起本，包含科目，数学（理科））', '（高起本，包含科目，外语）', '（高起本，包含科目，理化）', '（高起专，包含科目，语文）', '（专升本，包含科目，政治）', '（专升本，包含科目，外语）', '（外语，包含语种，英语）', '（外语，包含语种，日语）', '（艺术类，需要，专业加试）', '（体育类，需要，专业加试）', '（招生院校，组织，命题）', '（招生院校，组织，考试）', '（统考科目，包含类别，公共课）', '（统考科目，包含类别，专业基础课）', '（哲学，关联科目，大学语文）', '（工学，关联科目，高等数学（一））']"
研考成考,成人高考,考试篇,问：各科目考试的分数？答：高起本、高起专统一考试科目每科满分为150分，考试时间为120分钟。专升本统一考试科目每科满分为150分，考试时间为150分钟。注：以当年公布文件为准。,"['（高起本，每科满分，150分）', '（高起本，考试时间，120分钟）', '（高起专，每科满分，150分）', '（高起专，考试时间，120分钟）', '（专升本，每科满分，150分）', '（专升本，考试时间，150分钟）', '（高起本，参考依据，当年公布文件）', '（高起专，参考依据，当年公布文件）', '（专升本，参考依据，当年公布文件）']"
研考成考,成人高考,考试篇,问：成考有政策类照顾加分吗？答：有的。	（1）运动健将和武术项目武英级运动员称号获得者（须经省级体育行政部门审核并出具运动成绩证明），可以在考生考试成绩基础上增加 50 分投档，一级运动员称号获得者增加 30 分投档，是否录取由招生院校确定。（2）符合下列条件之一的考生，可以在考生考试成绩基础上增加 20 分投档，是否录取由招生院校确定。	①获得地级以上（含）人民政府，国务院各部委及各省（区、市）厅、局系统，国家特大型企业授予的劳动模范、先进生产（工作）者及科技进步（成果）奖获得者。②获得省级工、青、妇等组织授予“五一劳动奖章”、“新长征突击手”、“三八红旗手”称号者。③解放军、武警部队、公安干警荣立个人三等功以上者。④归侨、归侨子女、华侨子女、台湾省籍考生。⑤烈士子女、烈士配偶。⑥国防科技工业三线企业单位（位于地级以上人民政府所在地的除外）获得企业表彰的先进生产（工作）者。⑦边疆、山区、牧区和少数民族聚居地区的少数民族考生。⑧年满 25 周岁以上人员。即1998 年 12 月 31 日以前出生（在报考时满足条件直接勾选即可）。（3）自主就业的退役士兵，可以在考生考试成绩基础上增加 10 分投档，是否录取由招生院校确定。符合两项以上照顾政策的考生，其照顾分数不得累计。注：以当年公布文件为准。,"['（运动健将，获得加分，50分投档）', '（武术项目武英级运动员称号，获得加分，50分投档）', '（一级运动员称号，获得加分，30分投档）', '（劳动模范，获得加分，20分投档）', '（先进生产（工作）者，获得加分，20分投档）', '（科技进步（成果）奖获得者，获得加分，20分投档）', '（五一劳动奖章，获得加分，20分投档）', '（新长征突击手，获得加分，20分投档）', '（三八红旗手，获得加分，20分投档）', '（个人三等功，获得加分，20分投档）', '（归侨，获得加分，20分投档）', '（归侨子女，获得加分，20分投档）', '（华侨子女，获得加分，20分投档）', '（台湾省籍考生，获得加分，20分投档）', '（烈士子女，获得加分，20分投档）', '（烈士配偶，获得加分，20分投档）', '（企业表彰的先进生产（工作）者，获得加分，20分投档）', '（少数民族考生，获得加分，20分投档）', '（年满25周岁以上人员，获得加分，20分投档）', '（自主就业的退役士兵，获得加分，10分投档）', '（运动健将，需审核，省级体育行政部门）', '（地级以上（含）人民政府，授予，劳动模范）', '（国务院各部委及各省（区', '市）厅', '局系统，授予，劳动模范）', '（国家特大型企业，授予，劳动模范）', '（省级工', '青', '妇等组织，授予，五一劳动奖章）', '（省级工', '青', '妇等组织，授予，新长征突击手）', '（省级工', '青', '妇等组织，授予，三八红旗手）', '（国防科技工业三线企业单位，表彰，企业表彰的先进生产（工作）者）', '（照顾政策，包含，50分投档）', '（照顾政策，包含，30分投档）', '（照顾政策，包含，20分投档）', '（照顾政策，包含，10分投档）', '（50分投档，录取决定权，招生院校）', '（30分投档，录取决定权，招生院校）', '（20分投档，录取决定权，招生院校）', '（10分投档，录取决定权，招生院校）']"
研考成考,成人高考,考试篇,问：成人高考是否有免试入学？答：有的。满足以下条件可免试入学。（1）符合专升本报考条件的退役军人（自主就业退役士兵、自主择业军转干部、复员干部），凭身份证、退役证（义务兵/士官退出现役证、军官转业证书、军官复员证书）及符合相应的学历证书，可申请免试成人高校专升本。（2）获得“全国劳动模范”、“全国先进工作者”称号，“全国‘五一’劳动奖章”获得者，经本人申请并出具相关证书或证明，上海市教育考试院审核，招生院校同意，可免试入学。（3）奥运会、世界杯赛和世界锦标赛的奥运会项目前八名获得者、非奥运会项目前六名获得者；亚运会、亚洲杯赛和亚洲锦标赛的奥运会项目前六名获得者、非奥运会项目前三名获得者；全运会、全国锦标赛和全国冠军赛的奥运会项目前三名获得者、非奥运会项目冠军获得者。上述运动员经本人申请并出具省级体育行政部门审核的《优秀运动员申请免试进入成人高等学校学习推荐表》（国家体育总局监制），上海市教育考试院审核，招生学校同意，可免试入学。（4）参加“选聘高校毕业生到村任职”、“三支一扶（支教、支农、支医和扶贫）”、“大学生志愿服务西部计划”、“农村义务教育阶段学校教师特设岗位计划”等项目服务期满并考核合格的普通高职（专科）毕业生，凭身份证、普通高职（专科）毕业证、相关项目考核合格证，可申请免试成人高校专升本。注：以当年公布文件为准。,[]
研考成考,成人高考,考试篇,问：什么是单考？答：成人高校单考单招是由招生院校经审批进行的单独组织的文化考试（一般为体育类的高校，或者照顾类型的聋哑人群），按分数从高到低择优录取。,"['（单考，全称，成人高校单考单招）', '（成人高校单考单招，组织者，招生院校）', '（成人高校单考单招，类型，文化考试）', '（成人高校单考单招，针对，体育类高校）', '（成人高校单考单招，针对，聋哑人群）', '（成人高校单考单招，录取方式，择优录取）', '（择优录取，依据，分数）']"
研考成考,成人高考,考试篇,问：成人高考准考证哪里下载？什么时候可以下载？答：考生可以在规定时间内登录“上海招考热线”网站（www.shmeea.edu.cn）—首页—报名考试栏目选择对应链接下载准考证。注：2023年成考准考证下载时间在10月13日-10月20日每天9:00-22:00，10月21日-10月22日每天7:00-22:00。,"['（成人高考，需要，准考证）', '（准考证，下载网站，上海招考热线）', '（上海招考热线，网址，www.shmeea.edu.cn）', '（2023年成考，准考证下载时间，10月13日-10月20日每天9:00-22:00）', '（2023年成考，准考证下载时间，10月21日-10月22日每天7:00-22:00）']"
研考成考,成人高考,考试篇,问：成人高考考试中有哪些考场规则和注意事项？答：考生可在“上海招考热线”网站查看考场规则，“上海招考热线”—首页—研考成考—成人高校招生考试栏目“20XX年上海市成人高校招生统一考试考前提醒”公告内附件《20XX年上海市成人高校招生统一考试考场规则》《20XX 年上海市成人高校招生统一考试考生答题注意事项》。请所有考生务必在考前仔细阅读上述考场规则与注意事项，避免在考试期间出现违规行为。,[]
研考成考,成人高考,考试篇,问：考生如果迟到了，最晚什么时候可以进入考场？答：考生迟到15分钟后，不准进入考点参加当次科目考试；交卷出场时间不得早于每科目考试结束前30分钟。,"['（考生，参加，当次科目考试）', '（迟到15分钟，禁止进入，考点）', '（交卷出场时间，不得早于，考试结束前30分钟）', '（当次科目考试，位于，考点）']"
研考成考,成人高考,考试篇,问：考生身份证遗失如何进入考点？答：本人有效证件原件含：居民身份证（含有效期内的临时身份证）、有照片的社保卡、驾驶证、护照、军人证或公安部门开具带照片的临时身份证明。电子身份证不作为考试入场有效证件使用。,"['（居民身份证，属于，考试入场有效证件）', '（临时身份证，属于，考试入场有效证件）', '（社保卡，属于，考试入场有效证件）', '（驾驶证，属于，考试入场有效证件）', '（护照，属于，考试入场有效证件）', '（军人证，属于，考试入场有效证件）', '（临时身份证明，属于，考试入场有效证件）', '（电子身份证，不属于，考试入场有效证件）', '（考试入场有效证件，用于进入，考点）']"
研考成考,成人高考,考试篇,问：成人高考的数学考试可以携带计算器吗？答：成人高考考试只有高起本、高起专数学科目考试可以携带除电子存储记忆功能、收发信息功能、图像显示功能以外的计算器,[]
研考成考,成人高考,考试篇,问：考试现场没有钟表，考生可以自己带手表进入考场吗？答：见秋考93问。,"['（成人高考，属于，研考成考）', '（考试篇，属于，成人高考）', '（秋考93问，属于，考试篇）', '（考试现场，位于，考场）', '（考场，没有，钟表）', '（考生，携带，手表）']"
研考成考,成人高考,考试篇,问：申请合理便利的残疾考生所携带的助听器、人工耳蜗、拐杖、轮椅等可正常通过安检吗？答：见秋考94问。,[]
研考成考,成人高考,考试篇,问：考生有低血糖或听力障碍，腿脚不便等问题，该如何申请合理化便利？答：请考生提前将自身情况向第一志愿院校反映。,"['（考生，有，低血糖）', '（考生，有，听力障碍）', '（考生，有，腿脚不便）', '（考生，申请，合理化便利）', '（考生，反映，第一志愿院校）']"
研考成考,成人高考,考试篇,问：考生已经在上海报名，因为工作关系临时前往外省市。无法及时回上海参加成人高考。是否可以再次报考外省市的成人高考考试。答：上海市不接受和外省同时报名（含免试）的考生，一经发现将取消在上海市的报名、考试和录取资格。,"['（考生，在上海，报名）', '（考生，前往，外省市）', '（上海市，不接受，外省市同时报名）', '（考生，报考，外省市成人高考考试）', '（上海市，取消，录取资格）']"
研考成考,成人高考,考试篇,问：成人高考成绩一般什么时候公布？在哪里查询？答：考生可在规定时间内登录上海市教育考试院“上海招考热线”网站（www.shmeea.edu.cn）“成绩查询”栏目或“一网通办”PC端（zwdt.sh.gov.cn）、“随申办”移动端，选择“2022年上海市成人高校招生统一考试成绩查询”进入查询界面，输入本人准考证号和密码（初始密码为网上报名使用的证件号码后六位非字母的数字）查询成绩。注：2022年成人高考成绩公布时间是在11月25日10:00起。,"['（上海市教育考试院，运营，上海招考热线）', '（上海招考热线，网址，www.shmeea.edu.cn）', '（一网通办，网址，zwdt.sh.gov.cn）', '（成人高考成绩，查询方式，上海招考热线）', '（成人高考成绩，查询方式，一网通办）', '（成人高考成绩，查询方式，随申办）', '（成人高考成绩，属于，2022年上海市成人高校招生统一考试）', '（成人高考成绩，公布时间，2022年成人高考成绩公布时间）', '（2022年成人高考成绩公布时间，时间，11月25日10:00）', '（成绩查询，需要，准考证号）', '（成绩查询，需要，密码）', '（上海招考热线，包含，成绩查询）']"
