部分,考试类型,问题类型,问答对,三元组
高考学考,秋考,志愿篇,问：报考部队、公安、消防院校的政审、体检结果不认可，可以要求复核吗？答：报考部队、公安、消防院校的体检、政审和录取结果均由该上海市警备厅、上海市公安局负责，考试院仅公布录取结果，不做任何解释。,"['（体检，负责，上海市警备厅）', '（体检，负责，上海市公安局）', '（政审，负责，上海市警备厅）', '（政审，负责，上海市公安局）', '（录取结果，负责，上海市警备厅）', '（录取结果，负责，上海市公安局）', '（考试院，公布，录取结果）', '（部队院校，需进行，体检）', '（部队院校，需进行，政审）', '（公安院校，需进行，体检）', '（公安院校，需进行，政审）', '（消防院校，需进行，体检）', '（消防院校，需进行，政审）']"
高考学考,秋考,志愿篇,问：提前批次有投档分数线吗？答：请家长联系高校确认录取最低分数线，考生是否被录取的实际情况由高校决定。如家长坚持不认可，可记录考生的姓名、身份证、报名号核实具体情况，再行解释。,"['（提前批次，有，投档分数线）', '（家长，联系，高校）', '（高校，确认，录取最低分数线）', '（考生，有，姓名）', '（考生，有，身份证）', '（考生，有，报名号）']"
高考学考,秋考,志愿篇,问：本市本科艺术体育类专业招生批次如何设置？答：本市普通高校本科阶段艺术体育类专业招生设置本科艺体类甲、乙两个批次，每个批次各设顺序段和平行段，其中顺序段设置1个顺序方式的院校专业组志愿，平行段设置10个平行方式的院校专业组志愿。每个院校专业组志愿内设4个专业志愿和1个“愿否专业调剂”选项。,"['（本科艺术体育类专业，包含批次，本科艺体类甲批次）', '（本科艺术体育类专业，包含批次，本科艺体类乙批次）', '（本科艺体类甲批次，包含阶段，顺序段）', '（本科艺体类甲批次，包含阶段，平行段）', '（顺序段，设置志愿类型，顺序方式的院校专业组志愿）', '（平行段，设置志愿类型，平行方式的院校专业组志愿）', '（顺序方式的院校专业组志愿，数量，1个）', '（平行方式的院校专业组志愿，数量，10个）', '（院校专业组志愿，包含选项，专业志愿）', '（专业志愿，数量，4个）', '（院校专业组志愿，包含选项，愿否专业调剂选项）']"
高考学考,秋考,志愿篇,问：哪些专业属于艺术类专业？哪些艺术类专业需组织专业考试？答：2024年《普通高等学校本科专业目录》中“艺术学”门类下设各专业，以及《职业教育专业目录（2021年）》中高等职业教育本科和专科专业“艺术设计类”“表演艺术类”下设各专业和“民族文化艺术类”“广播影视类”等部分专业，统称为艺术类专业。,"['（2024年《普通高等学校本科专业目录》，包含，艺术学）', '（《职业教育专业目录（2021年）》，包含，高等职业教育本科）', '（《职业教育专业目录（2021年）》，包含，专科专业）', '（高等职业教育本科，包含，艺术设计类）', '（高等职业教育本科，包含，表演艺术类）', '（专科专业，包含，艺术设计类）', '（专科专业，包含，表演艺术类）', '（专科专业，包含，民族文化艺术类）', '（专科专业，包含，广播影视类）', '（艺术设计类，统称为，艺术类专业）', '（表演艺术类，统称为，艺术类专业）', '（民族文化艺术类，统称为，艺术类专业）', '（广播影视类，统称为，艺术类专业）']"
高考学考,秋考,志愿篇,问：本科艺体类批次的录取顺序？答：本科两个批次的招录顺序为：甲批次顺序段—甲批次平行段—乙批次顺序段—乙批次平行段。,"['（高考学考，关联，秋考）', '（秋考，关联，志愿篇）', '（本科艺体类批次，录取顺序，本科两个批次）', '（甲批次顺序段，下一阶段，甲批次平行段）', '（甲批次平行段，下一阶段，乙批次顺序段）', '（乙批次顺序段，下一阶段，乙批次平行段）']"
高考学考,秋考,志愿篇,问：艺术类专业采取什么样的招生录取办法？答：艺术类专业依据考生高考文化成绩、专业考试成绩，参考综合素质评价进行招生录取。分为四类情况：（1）对于不使用专业考试成绩的专业，直接依据考生高考文化课成绩、参考考生综合素质评价，择优录取。（2）对于使用省级统考成绩作为专业考试成绩的专业，在考生高考文化课成绩和省级统考成绩均达到所在省（区、市）艺术类专业录取控制分数线基础上，依据考生高考文化课成绩和省级统考成绩按比例合成的综合成绩择优录取，其中高考文化课成绩所占比例原则上不低于50%，具体投档录取办法由各省（区、市）确定。（3）对于少数组织校考的高校艺术类专业，在考生高考文化课成绩达到所在省（区、市）普通类专业本科批次录取控制分数线、省级统考成绩合格且达到学校划定的成绩要求基础上，依据考生志愿和校考成绩择优录取。鼓励校考高校结合专业培养要求，进一步提高考生高考文化课成绩录取要求。对于在相关专业领域具有突出才能和表现的考生，高校可探索高考文化课成绩破格录取，具体办法由招生高校提前向社会公布。（4）对于实行省际联考的高校戏曲类专业，使用省际联考成绩作为考生专业考试成绩。在考生高考文化课成绩达到所在省（区、市）戏曲类专业高考文化课录取控制分数线基础上，依据考生志愿和省际联考成绩择优录取。,"['（艺术类专业，依据，高考文化成绩）', '（艺术类专业，依据，专业考试成绩）', '（艺术类专业，参考，综合素质评价）', '（不使用专业考试成绩的专业，依据，高考文化课成绩）', '（不使用专业考试成绩的专业，参考，综合素质评价）', '（使用省级统考成绩作为专业考试成绩的专业，要求，高考文化课成绩）', '（使用省级统考成绩作为专业考试成绩的专业，要求，省级统考成绩）', '（综合成绩，合成，高考文化课成绩）', '（综合成绩，合成，省级统考成绩）', '（投档录取办法，确定，各省（区', '市））', '（校考，要求，高考文化课成绩）', '（校考，要求，省级统考成绩）', '（校考，依据，校考成绩）', '（校考，依据，考生志愿）', '（省际联考，使用，戏曲类专业）', '（省际联考，依据，省际联考成绩）', '（省际联考，依据，考生志愿）']"
高考学考,秋考,志愿篇,问：考生如果没有参加艺术类统考可以填报艺术类顺序段志愿吗？答：具备报名资格的艺术类考生可以根据《2024年上海市普通高等学校招生专业目录》中公布的具体招生院校专业组名单和相关说明进行志愿填报。《2024年上海市普通高等学校招生专业目录》艺术类甲批次顺序类31所高校招生可自定招生要求，考生填报此类院校可能需要参加校考、或艺术类统考，也可能要同时参加校考和艺术类统考。,"['（艺术类考生，具备，报名资格）', '（艺术类考生，根据，《2024年上海市普通高等学校招生专业目录》）', '（《2024年上海市普通高等学校招生专业目录》，包含，招生院校专业组名单）', '（《2024年上海市普通高等学校招生专业目录》，包含，相关说明）', '（艺术类考生，可能需要参加，校考）', '（艺术类考生，可能需要参加，艺术类统考）', '（招生院校专业组名单，包含，艺术类甲批次顺序类31所高校）']"
高考学考,秋考,志愿篇,问：考生文化分数没有达到艺术类本科文化控制分数线，是否可以填报艺术类顺序段志愿？答：考生可查看意向高校的招生简章，或直接与意向高校联系，确认高校招生需要的文化分数线、是否需要校考、是否需要艺术类统考合格证。,"['（艺术类顺序段志愿，要求，艺术类本科文化控制分数线）', '（考生，查看，招生简章）', '（高校，发布，招生简章）', '（考生，联系，高校）', '（高校，需要，文化分数线）', '（高校，需要，校考）', '（高校，需要，艺术类统考合格证）']"
高考学考,秋考,志愿篇,问：考生文化分数没有达到艺术类本科文化控制分数线，是否可以填报艺体类除甲顺以外的志愿吗？答：如考生文化分数没有达到艺术类本科文化控制分数线，，无法填报艺体类甲批次平行段、艺体类乙批次顺序段、艺体类乙批次平行段志愿。注：以上是2024年高考相关信息。,"['（考生，未达到，艺术类本科文化控制分数线）', '（考生，无法填报，艺体类甲批次平行段）', '（考生，无法填报，艺体类乙批次顺序段）', '（考生，无法填报，艺体类乙批次平行段）', '（信息，属于，2024年高考）']"
高考学考,秋考,志愿篇,问：考生如果没有参加艺术类统考，可以填报艺术类平行段志愿吗？答：无法填报。,"['（考生，无法填报，艺术类平行段志愿）', '（艺术类平行段志愿，需参加，艺术类统考）']"
高考学考,秋考,志愿篇,问：哪些考生可以填报艺术类平行志愿？答：高考文化成绩达到艺体类本科文化控制分数线且专业统考成绩合格的考生可填报该批次对应专业类别的平行段相关志愿。考生应以文化成绩和专业统考成绩折算后产生的投档成绩作为平行志愿填报的参考依据。,"['（考生，需达到，艺体类本科文化控制分数线）', '（考生，需通过，专业统考成绩）', '（投档成绩，由折算，高考文化成绩）', '（投档成绩，由折算，专业统考成绩）', '（艺术类平行志愿，包含，平行段相关志愿）', '（考生，可填报，艺术类平行志愿）', '（平行志愿，参考依据，投档成绩）']"
高考学考,秋考,志愿篇,问：艺术类专业统考成绩多少分合格？答：2024年艺术类统考合格线以“上海招考热线”网站（www.shmeea.edu.cn）发布信息为准。,"['（艺术类专业统考，包含成绩，统考成绩）', '（统考成绩，合格线为，合格线）', '（合格线，年份为，2024年）', '（上海招考热线，发布，合格线）', '（上海招考热线，官网为，www.shmeea.edu.cn）']"
高考学考,秋考,志愿篇,问：2024年起，在本市艺术类批次平行段采用统考成绩的艺术类专业如何开展投档录取？答：对于在平行段以市级专业统考成绩作为专业考试成绩的艺术类专业，在考生满足高考文化课成绩和市级专业统考成绩均达到本市艺术类专业录取最低控制分数线的基础上，按考生高考文化课成绩和市级专业统考成绩各占50%的比例合成投档成绩进行平行志愿投档录取。即：本科投档成绩=文化成绩×50%+专业统考成绩×660/300×50%；专科投档成绩=文化成绩×50%+专业统考成绩×450/300×50%；注：以上是2024年高考相关信息。,"['（艺术类专业，采用，统考成绩）', '（投档录取，基于，高考文化课成绩）', '（投档录取，基于，市级专业统考成绩）', '（投档成绩，合成自，文化成绩）', '（投档成绩，合成自，专业统考成绩）', '（本科投档成绩，属于，投档成绩）', '（专科投档成绩，属于，投档成绩）', '（平行志愿投档录取，关联，投档录取）', '（艺术类专业录取最低控制分数线，影响，投档录取）', '（艺术类专业，实施时间，2024年起）']"
高考学考,秋考,志愿篇,问：考生如果没有参过体育类统考可以填报体育类平行段志愿吗？答：无法填报。,"['（高考学考，包含，秋考）', '（秋考，包含，志愿篇）', '（志愿篇，包含，体育类平行段志愿）', '（体育类平行段志愿，需要，体育类统考）']"
高考学考,秋考,志愿篇,问：参加了艺体类专业统一考试后，考生一定要填报报艺体类专业吗？答：不一定。若考生的艺体类专业考试达到专业合格线，但在填报本科志愿时不想填报本科阶段艺体类专业了，可以选择符合填报条件的非艺体类专业进行填报。,"['（高考学考，包含，秋考）', '（秋考，包含，志愿篇）', '（考生，参加，艺体类专业统一考试）', '（艺体类专业统一考试，针对，艺体类专业）', '（考生，达到，专业合格线）', '（考生，填报，填报本科志愿）', '（填报本科志愿，可选择，本科阶段艺体类专业）', '（填报本科志愿，可选择，非艺体类专业）', '（本科阶段艺体类专业，属于，艺体类专业）']"
高考学考,秋考,志愿篇,"问：报了本科艺体类批次志愿，还能再报本科提前批次志愿吗？答：报考本科艺体类批次志愿的考生,不得兼报本科提前批次志愿，但仍可填报本科其他批次专业志愿（如：本科普通批次）。","['（考生，不得兼报，本科提前批次志愿）', '（考生，可填报，本科其他批次专业志愿）', '（本科其他批次专业志愿，例如，本科普通批次）']"
高考学考,秋考,志愿篇,"问：在本科艺体类甲批次顺序段招生的院校有哪些？答：在本科艺体类甲批次顺序段开展招生的院校主要为教育部批准的独立设置本科艺术院校和参照独立设置本科艺术院校,具体见《20XX年上海市普通高等学校招生专业目录》。","['（本科艺体类甲批次顺序段，开展招生，院校）', '（教育部，批准，独立设置本科艺术院校）', '（教育部，批准，参照独立设置本科艺术院校）', '（本科艺体类甲批次顺序段，见，20XX年上海市普通高等学校招生专业目录）']"
高考学考,秋考,志愿篇,问：在本科艺体类甲批次平行段招生的院校有哪些？答：凡按照艺体类专业统考开展招生的院校，一般在本科艺体类甲批次平行段开展招生，详情请查看《20XX年上海市普通高等学校招生专业目录》。,"['（院校，招生批次，本科艺体类甲批次平行段）', '（院校，招生依据，艺体类专业统考）', '（本科艺体类甲批次平行段，详情查看，《20XX年上海市普通高等学校招生专业目录）']"
高考学考,秋考,志愿篇,问：艺体类考生在填报平行段志愿碰上同分如何决定录取先后顺序？答：本科艺体类批次平行段同分考生按以下位序排序：第1位序，比较专业统考成绩，高者优先。第2位序，比较语文加数学两门合计成绩高低，高者优先。第3位序，比较语文或数学中单科成绩高低，高者优先。第4位序，比较外语成绩高低，高者优先。第5位序，比较选考科目中单科成绩高低，高者优先。第6位序，比较选考科目中次高科成绩高低，高者优先。第7位序，比较考生志愿顺序，按各自顺序分别投档。志愿顺序相同的同分同位考生同时投档。,"['（本科艺体类批次平行段，包含，同分考生）', '（同分考生，排序依据，专业统考成绩）', '（同分考生，排序依据，语文加数学两门合计成绩）', '（同分考生，排序依据，语文或数学中单科成绩）', '（同分考生，排序依据，外语成绩）', '（同分考生，排序依据，选考科目中单科成绩）', '（同分考生，排序依据，选考科目中次高科成绩）', '（同分考生，排序依据，考生志愿顺序）', '（考生志愿顺序，决定，投档）', '（同分同位考生，属于，同分考生）']"
高考学考,秋考,志愿篇,问：什么时候能查询到艺体类甲批次平行段院校专业组投档分数线？答：考生请及时关注上海市教育考试院上海招考热线网站（www.shmeea.edu.cn）首页—高考学考—秋季高考栏目相关通知。注：2024年秋考艺体类平行段投档分数线发布于2024年7月11日。,"['（上海市教育考试院，运营，上海招考热线网站）', '（上海招考热线网站，网址，www.shmeea.edu.cn）', '（高考学考，包含，秋季高考栏目）', '（艺体类甲批次平行段院校专业组投档分数线，发布于，2024年7月11日）']"
高考学考,秋考,志愿篇,问：甲批次有未招满计划数的高校，可以在乙批次顺序批次和平行批次进行填报？答：是的。考试院会公布本科艺体类乙批次专业组计划表（含缺额计划）以及本科艺体类乙批次可填报志愿考生成绩分布表（公布的是各类别文化成绩和专业成绩折算后的综合成绩）。,[]
高考学考,秋考,志愿篇,问：什么时候能查询艺体类乙批次顺序段和平行段录取结果？答：考生可登录“上海招考热线”网站（www.shmeea.edu.cn）首页—录取查询。（具体以上海招考热线公告信息为准）。,"['（上海招考热线，网址，www.shmeea.edu.cn）', '（上海招考热线，提供，录取查询）', '（录取查询，用于查询，录取结果）', '（艺体类乙批次顺序段，有，录取结果）', '（平行段，有，录取结果）', '（公告信息，发布在，上海招考热线）']"
高考学考,秋考,志愿篇,问：考生已被艺术类院校录取后，是否可以放弃再参与后续普通批次的志愿录取？答：考生被前面所填的志愿录取后，后面填报的所有院校专业组志愿就自然失效了，不再参与后面志愿的录取。,"['（考生，被录取，艺术类院校）', '（录取，导致失效，院校专业组志愿）', '（录取，导致无法参与，普通批次）']"
高考学考,秋考,志愿篇,"问：考生若要填报体育类专业，需要具备哪些基本条件？答：需要具备以下基本条件：（1）符合2024年上海市普通高等学校招生的报考条件。（2）身体健康。根据教育部、原卫生部、中国残疾人联合会制定的《普通高等学校招生体检工作指导意见》，报考体育教育、运动训练、运动体育科学、民族传统体育专业，对轻度色觉异常（俗称“色弱”）和色觉异常II度（俗称“色盲”）者，学校可以不予录取。各有关体育院校专业组（专业）可根据专业培养要求，提出对考生身体健康状况的补充规定并在《招生章程》中予以公布。（3）填报体育类专业的考生,须参加全市体育类专业统考（包括身体素质考试和专项技术考试），取得合格证者方可报考。（4）按规定参加秋季统一高考和高中学业水平等级性考试取得文化成绩。高考总分不得低于体育类本科文化控制线（本市本科录取控制分数线的70%）。","['（体育类专业，需要符合，2024年上海市普通高等学校招生）', '（体育类专业，需要具备，身体健康）', '（体育教育，属于，体育类专业）', '（运动训练，属于，体育类专业）', '（运动体育科学，属于，体育类专业）', '（民族传统体育专业，属于，体育类专业）', '（普通高等学校招生体检工作指导意见，限制，轻度色觉异常）', '（普通高等学校招生体检工作指导意见，限制，色觉异常II度）', '（体育院校专业组，提出，身体健康状况补充规定）', '（招生章程，公布，身体健康状况补充规定）', '（体育类专业，需参加，体育类专业统考）', '（体育类专业统考，包含，身体素质考试）', '（体育类专业统考，包含，专项技术考试）', '（体育类专业，需取得，合格证）', '（体育类专业，需参加，秋季统一高考）', '（体育类专业，需参加，高中学业水平等级性考试）', '（高考总分，不低于，体育类本科文化控制线）', '（体育类本科文化控制线，基于，本科录取控制分数线）']"
高考学考,秋考,志愿篇,问：填报体育类本科专业后是否可以再填报本科提前批志愿？答：不可以。,"['（高考学考，包含，秋考）', '（秋考，包含，志愿篇）', '（体育类本科专业，不可同时填报，本科提前批志愿）']"
高考学考,秋考,志愿篇,问：已经被录取体育类专业的考生，后续填的本科普通批次是否还会再录取？答：考生被前面所填的志愿录取后，后面填报的所有院校专业组志愿就自然失效了，不再参与后面志愿的录取。,"['（高考学考-秋考-志愿篇，包含，体育类专业）', '（高考学考-秋考-志愿篇，包含，本科普通批次）', '（考生，填报，本科普通批次）', '（考生，被录取，体育类专业）', '（院校专业组志愿，属于，志愿）']"
高考学考,秋考,志愿篇,问：体育单招是否也要填报志愿？答：体育单招请联系报考意向高校，由意向高校负责。,"['（高考学考，包含，秋考）', '（秋考，包含，志愿篇）', '（体育单招，联系，报考意向高校）', '（体育单招，负责，意向高校）']"
高考学考,秋考,志愿篇,"问：什么是地方农村专项计划？答： 根据教育部有关文件精神，本市2024年继续实施普通高校招生市属高校“地方农村专项计划”。在本科提前批次和艺体类批次录取结束后、本科普通批次录取之前,设置地方农村专项计划批次。本批次设置4个院校专业组顺序志愿。每个院校专业组志愿内设置4个专业志愿和1个“愿否专业调剂”选项。符合条件的本市农村户籍考生均可填报。上海市教育考试院在填报志愿前，会在""上海招考热线”网站（https://www.shmeea.edu.cn）上公示符合报考资格的考生名单。符合填报资格且愿意填报“地方农村专项计划”志愿的考生，可按规定进行填报，也可同时填报其他批次本科志愿。
投档时，上海市教育考试院根据顺序志愿的投档原则,按院校专业组计划的1：1.2投档，由院校进行录取。
未被“地方农村专项计划”录取的考生，不影响其后面批次的录取。","['（地方农村专项计划，属于，普通高校招生）', '（市属高校，实施，地方农村专项计划）', '（地方农村专项计划，实施年份，2024年）', '（地方农村专项计划批次，设置，4个院校专业组顺序志愿）', '（4个院校专业组顺序志愿，包含，4个专业志愿）', '（4个院校专业组顺序志愿，包含，愿否专业调剂）', '（本市农村户籍考生，可填报，地方农村专项计划）', '（上海市教育考试院，公示，符合报考资格的考生名单）', '（上海市教育考试院，使用，上海招考热线）', '（上海招考热线，网址，https://www.shmeea.edu.cn）', '（顺序志愿的投档原则，对应，1：1.2投档）', '（上海市教育考试院，根据，顺序志愿的投档原则）', '（院校，执行，录取）']"
高考学考,秋考,志愿篇,问：2025年还会有农村专项计划招生吗？答：暂无通知。,"['（高考学考，包含，秋考）', '（秋考，包含，志愿篇）', '（农村专项计划招生，涉及时间，2025年）']"
高考学考,秋考,志愿篇,问：什么是高水平运动队招生？答：高校高水平运动队主要是选拔培养德智体美劳全面发展且具有较高体育竞技水平的学生，为奥运会、世界大学生运动会等重大体育比赛和国家竞技体育后备人才培养体系提供人才支撑。,[]
