部分,考试类型,问题类型,问答对,筛选后三元组
中考中招,中考中招,志愿篇,问：填报名额分配到区志愿须注意哪些问题？答：学生在填报名额分配到区志愿时，首先要通过初中学校和区招考机构了解投档录取区的名额分配到区招生学校和计划数，根据自身情况慎重选择1所学校填报。其次名额分配到区招生学校中部分为外区招生学校，学生和家长要了解所选学校是否有住宿条件、交通是否便利等情况。如果学生被名额分配到区志愿学校录取，则后续的其他志愿自然失效，且学生不得要求放弃名额分配到区志愿而顺延录取后续其他志愿。学生不填报名额分配到区志愿或填报了名额分配到区志愿但未被录取，均不影响后续志愿录取。,"['(名额分配到区志愿, 需咨询, 初中学校和区招考机构)', '(学生, 填报名额分配到区志愿需通过, 初中学校和区招考机构)', '(名额分配到区招生学校, 部分为, 外区招生学校)', '(名额分配到区招生学校, 需考虑, 住宿条件)', '(名额分配到区招生学校, 需考虑, 交通是否便利)', '(被名额分配到区志愿学校录取, 导致, 后续其他志愿失效)']"
中考中招,中考中招,志愿篇,问：名额分配到校招生学校有哪些？答：名额分配到校招生是指市实验性示范性高中将部分招生计划分配到相应不选择生源初中学校的招生方法。不选择生源初中在籍在读满3年并完成中招报名的初三学生可填报2个名额分配到校招生录取志愿。名额分配到校志愿栏内可填报的学校是：学生学籍所在初中学校有名额分配到校计划的委属市实验性示范性高中、区属市实验性示范性高中。,"['(市实验性示范性高中, 分配招生计划至, 不选择生源初中学校)', '(不选择生源初中在籍在读满3年并完成中招报名的初三学生, 可填报, 名额分配到校招生录取志愿)', '(委属市实验性示范性高中, 分配到校计划, 学籍所在中学)', '(不选择生源初中在籍在读满3年学生, 需完成, 中招报名)']"
中考中招,中考中招,志愿篇,问：哪里可以查看所有的名额分配到校院校信息？答：学生可通过各区招考机构编写的高中阶段招生计划书了解当年度报名所在区的相关招生学校和招生计划。,"['(学生, 查阅, 高中阶段招生计划书)', '(区考试招生机构, 编写, 高中阶段招生计划书)', '(高中阶段招生计划书, 包含, 招生学校信息)']"
中考中招,中考中招,志愿篇,问：填报名额分配到校志愿须注意哪些问题？答：学生在填报名额分配到校志愿时，要通过学籍所在初中学校和区招考机构了解名额分配到校招生学校和计划数，根据自身情况慎重选择2所学校填报。学生填报资格由初中学籍所在学校认定，并须于补报名结束后公示5个工作日，公示无异议后报区教育行政部门备案。返沪生、往届生和跨区报名的应届生及不符合条件的应届生不能填报名额分配到校志愿。录取时，名额分配到区志愿在先，名额分配到校志愿在后。如果学生被名额分配到校志愿学校录取，则后续志愿自然失效，且学生不得要求放弃名额分配到校志愿而顺延录取后续志愿。学生不填报名额分配到校志愿或填报了名额分配到校志愿但未被录取，均不影响后续志愿录取。,[]
中考中招,中考中招,志愿篇,问：什么是1至15志愿？答：1至15志愿是统一招生录取志愿中的主要志愿，学生可选择填报在投档录取区有招生计划的高中阶段学校（含普通高中学校和中职校），共可填报15个志愿。,"['(1至15志愿, 是, 统一招生录取志愿中的主要志愿)', '(1至15志愿, 是, 统一招生录取志愿中的主要志愿)', '(高中阶段学校, 包含, 普通高中学校)', '(高中阶段学校, 包含, 中职校)']"
中考中招,中考中招,志愿篇,问：哪里可以查看所有的15个平行志愿学校信息？答：学生可通过各区招考机构编写的高中阶段招生计划书了解当年度报名所在区的相关招生学校和招生计划。,"['(学生, 查阅, 各区招考机构编写的高中阶段招生计划书)', '(区考试招生机构, 编写, 高中阶段招生计划书)', '(高中阶段招生计划书, 包含, 招生学校)', '(高中阶段招生计划书, 针对, 报名所在区)']"
中考中招,中考中招,志愿篇,问：填报1至15志愿须注意哪些问题？答：1至15志愿栏共设有15个志愿，学生根据本人学业成绩、综合素质评定和升学意向进行填报。填多少个志愿由学生自主决定，不超过15个志愿即可，学生须慎重考虑填报志愿学校的顺序。,"['(学生, 参考因素, 综合素质评定)', '(学生, 填报依据, 升学意向)']"
中考中招,中考中招,志愿篇,问：什么是征求志愿？ 学生如何填报？答：1至15志愿投档录取完成后，区招考机构通知未被录取且在志愿填报时勾选“愿意征求”的学生填报征求志愿。学生可填报有剩余招生计划的学校，填报后由区招考机构按学生的征求志愿，从高分到低分投档录取。,"['(志愿篇, 属于, 中考中招)', '(1至15志愿投档录取, 之后进行, 征求志愿)', '(愿意征求, 是前提条件, 征求志愿)', '(征求志愿, 允许填报, 有剩余招生计划的学校)', '(区考试招生机构, 投档录取方式, 从高分到低分)']"
中考中招,中考中招,志愿篇,问：哪些学校可能会有征求志愿填报的机会？答：征求志愿的学校必须是按志愿投档后尚未完成招生计划的学校。这些学校有普通高中学校（以收费较高的民办高中为主），也有中职校。未完成招生计划的民办高中国际课程班也可在征求志愿阶段补录取未被其他学校录取的学生。考生可以联系报考所在区招考机构，了解征求志愿学校名单。,"['(志愿篇, 讨论主题, 征求志愿填报的机会)', '(学校, 分类, 普通高中学校)', '(征求志愿学校, 类型包括, 中职校)', '(民办高中国际课程班, 补录取对象, 未被其他学校录取的学生)', '(考生, 联系, 区考试招生机构)', '(区考试招生机构, 提供, 征求志愿学校名单)']"
中考中招,中考中招,志愿篇,问：区级优秀体育学生招生工作如何开展？答：区级优秀体育学生招生工作由各区教育、体育行政部门负责，参照市级优秀体育学生的招生录取办法在统一招生批次进行，招生学校仅限本区内区实验性示范性高中与公民办普通高中。区级优秀体育学生正式体育比赛认定目录，由各区教育、体育行政部门共同商定。区实验性示范性高中与公办普通高中录取的区级优秀体育学生学业考试总成绩须达到当年度本市公办普通高中最低投档控制分数线，民办普通高中录取的区级优秀体育学生学业考试总成绩须达到已公布的本校招生录取最低投档控制分数线。,[]
中考中招,中考中招,志愿篇,问：区级艺术骨干学生招生工作如何开展？答：区级艺术骨干学生招生工作由各区教育行政部门负责，参照市级艺术骨干学生的招生录取办法在统一招生批次进行，招生学校仅限本区内区实验性示范性高中与公民办普通高中。区实验性示范性高中与公办普通高中录取的区级艺术骨干学生学业考试总成绩须达到当年度本市公办普通高中最低投档控制分数线，民办普通高中录取的区级艺术骨干学生学业考试总成绩须达到已公布的本校招生录取最低投档控制分数线。,"['(区级艺术骨干学生招生工作, 负责部门, 各区教育行政部门)', '(区级艺术骨干学生招生工作, 参照, 市级艺术骨干学生招生录取办法)', '(区级艺术骨干学生招生工作, 招生批次, 统一招生批次)', '(区实验性示范性高中与公办普通高中, 区级艺术骨干学生学业成绩要求, 当年度本市公办普通高中最低投档控制分数线)', '(民办普通高中, 录取分数线, 最低投档控制分数线)', '(招生学校, 限定范围, 本区内的区实验性示范性高中与公民办普通高中)']"
中考中招,中考中招,志愿篇,问：区级优秀体育学生、艺术骨干学生如何填报志愿？答：通过相关资格确认的区级优秀体育学生、艺术骨干学生，在学业考试结束后，可登录“上海招考热线”网站（www.shmeea.edu.cn），进入名额分配综合评价录取志愿和统一招生录取志愿填报页面，在“区级优秀体育学生、艺术骨干学生”志愿栏内填报1个志愿。,"['(区级优秀体育学生, 需通过, 资格确认)', '(区级优秀艺术骨干学生, 通过, 资格确认)', '(区级优秀体育学生, 登录, 上海市教育考试院报名网站)', '(艺术骨干学生, 登录, 上海市教育考试院报名网站)', '(区级优秀艺术骨干学生, 填报, 名额分配综合评价录取志愿)']"
中考中招,中考中招,志愿篇,"问：中招有加分政策吗？答：有的，具体加分查看下表。2023年上海市高中阶段学校招生录取政策性照顾加分及同分优待项目一览表
编号：1；政策性照顾条件：烈士子女；证明单位：区退役军人事务局；分值：20分
编号：2；政策性照顾条件：现役三类（含三类）以上艰苦边远地区军人子女；现役二类（含二类）以上岛屿部队军人子女；现役西藏自治区部队军人子女；现役飞行、潜艇、航天、涉核等高风险、高危害岗位军人子女；证明单位：上海警备区政治工作局；分值：20分
编号：3；政策性照顾条件：现役作战部队军人子女；现役一、二类艰苦边远地区或三类岛屿部队军人子女；因公牺牲的军人的子女；一至四级残疾军人的子女；平时荣获二等功或战时荣获三等功及以上的现役军人子女；证明单位：上海警备区政治工作局、区退役军人事务局；分值：10分
编号：4；政策性照顾条件：英雄模范和因公牺牲、一至四级因公伤残消防救援人员子女和驻边远艰苦地区等在职消防救援人员子女；证明单位：上海市消防救援总队、区退役军人事务局；分值：10分
编号：5；政策性照顾条件：全国公安系统一级、二级英雄模范的子女；因公牺牲的公安民警的子女；一至四级残疾的公安民警的子女；证明单位：省级公安机关；分值：10分
编号：6；政策性照顾条件：归侨青少年、归侨子女、华侨在国内的子女；证明单位：户口所在区侨务部门；分值：5分
编号：7；政策性照顾条件：少数民族学生；证明单位：学生提供户口簿原件（16周岁以上学生须出示身份证原件）；分值：5分
编号：8；政策性照顾条件：台湾省学生；证明单位：初中就读学校所在区台办；分值：5分
编号：9；政策性照顾条件：来本市落户的留学回国人员的随归子女，或持有效期一年及以上《上海市海外人才居住证》的留学人员的随归子女，在国外连续生活满5年以上，并在国内语言文字适应期（3年）内的学生；证明单位：上海市人力资源社会保障局留学人员工作处；分值：5分
编号：10；政策性照顾条件：除上述第2、3、4类以外其他现役军人子女和在职消防救援人员子女；证明单位：上海警备区政治工作局、上海市消防救援总队；分值：同分优待
注：1．上述照顾项目不可累计。其中，现役军人子女和在职消防救援人员子女政策性照顾加分对象由相关部门统一公示；其他加分对象须经市、区、学校三级公示。2．同分优待的照顾对象在名额分配综合评价综合录取以及统一招生录取批次时均可享受照顾政策。","['(中招, 具有, 加分政策)', '(上海市中招加分政策, 详细列出在, 2023年上海市高中阶段学校招生录取政策性照顾加分及同分优待项目一览表)', '(现役军人子女, 属于, 政策性照顾加分对象)', '(在职消防救援人员子女, 属于, 政策性照顾加分对象)', '(现役军人子女和在职消防救援人员子女, 公示方, 有关部门)', '(同分优待的照顾对象, 享受照顾政策, 名额分配综合评价综合录取)', '(同分优待的照顾对象, 适用于, 名额分配综合评价综合录取及统一招生录取批次)','(烈士子女, 政策性照顾分值, 20)', '(现役三类以上艰苦边远地区军人子女, 政策性照顾分值, 20)', '(现役二类以上岛屿部队军人子女, 政策性照顾分值, 20)', '(现役西藏自治区部队军人子女, 政策性照顾分值, 20)', '(现役飞行潜艇航天涉核等高风险高危害岗位军人子女, 政策性照顾分值, 20)', '(现役作战部队军人子女, 政策性照顾分值, 10)', '(现役一二类艰苦边远地区三类岛屿部队军人子女, 政策性照顾分值, 10)', '(因公牺牲军人的子女, 政策性照顾分值, 10)', '(一至四级残疾军人的子女, 政策性照顾分值, 10)', '(平时荣获二等功或战时荣获三等功及以上的现役军人子女, 政策性照顾分值, 10)', '(英雄模范和因公牺牲一至四级因公伤残消防救援人员子女, 政策性照顾分值, 10)', '(驻边远艰苦地区等在职消防救援人员子女, 政策性照顾分值, 10)', '(全国公安系统一级二级英雄模范的子女, 政策性照顾分值, 10)', '(因公牺牲的公安民警的子女, 政策性照顾分值, 10)', '(一至四级残疾的公安民警的子女, 政策性照顾分值, 10)', '(归侨青少年、归侨子女、华侨在国内的子女, 政策性照顾分值, 5)', '(少数民族学生, 政策性照顾分值, 5)', '(台湾省学生, 政策性照顾分值, 5)', '(来本市落户的留学回国人员的随归子女, 政策性照顾分值, 5)', '(持有效期一年及以上上海市海外人才居住证的留学人员的随归子女, 政策性照顾分值, 5)', '(在国外连续生活满5年以上并在国内语言文字适应期3年内的学生, 政策性照顾分值, 5)', '(除上述第2、3、4类以外其他现役军人子女和在职消防救援人员子女, 政策性照顾分值,同分优待)']"
中考中招,中考中招,志愿篇,问：如何申请中招加分？答：根据教育部规范加分的有关要求，结合本市实际，制定中招政策性照顾加分及同分优待政策，严格执行加分及同分优待资格核准和公示制度。2023 年中招政策性照顾加分及同分优待具体项目及分值等见621问图表。符合政策性照顾对象申请截止时间为 2023 年 5 月 31日。各相关部门和学校须严格核准申请政策性照顾学生的资格，每级核准部门和学校均须对相应学生公示 5 个工作日，如有举报并经核实确认的一律取消其照顾资格。如符合多项政策性照顾项目的，只可享受其中一项，不予累计。注：内容出处《上海市教育委员会关于2023年本市高中阶段学校招生工作的若干意见》沪教委基〔2023〕5号。,"['(上海市教育委员会, 制定, 中招政策性照顾加分及同分优待政策)', '(上海市教育委员会, 制定, 中招政策性照顾加分及同分优待政策)', '(中招政策性照顾加分及同分优待政策申请, 申请截止时间, 2023年5月31日)', '(相关部门和学校, 核准资格, 政策性照顾学生)', '(相关部门和学校, 核准, 政策性照顾学生的资格)', '(相关部门和学校, 公示, 5个工作日)', '(中招核准部门及学校, 公示, 符合条件的中招政策照顾学生)', '(举报, 经核实导致, 取消照顾资格)']"
研考成考,研究生招生考试,录取后相关事件篇,问：随迁子女收到录取通知书时发现录取的并不是自己当时所填的中职校专业？答：根据《上海市教育委员会关于做好2023年上海市全日制普通中等职业学校自主招收本市初中应届毕业生中来沪人员随迁子女工作的通知》（沪教委职〔2023〕14号）文件要求。普通中职校志愿投档录取时不分专业，学生进校后，学校根据学生成绩、志愿及计划等进行专业分班和调剂。,"['(普通中职校, 录取方式, 不分专业)', '(普通中职校, 进行, 专业分班和调剂)', '(普通中职校, 执行, 专业调剂)']"
研考成考,研究生招生考试,报名篇,问：硕士研究生考生的报名条件？答：（1）中华人民共和国公民。（2）拥护中国共产党的领导，品德良好，遵纪守法。（3）身体健康状况符合国家和招生单位规定的体检要求。（4）考生学业水平必须符合下列条件之一：①国家承认学历的应届本科毕业生（含普通高校、成人高校、普通高校举办的成人高等学历教育等应届本科毕业生）及自学考试和网络教育届时可毕业本科生。考生录取当年入学前（具体时限由招生单位规定，下同）必须取得国家承认的本科毕业证书或教育部留学服务中心出具的《国（境）外学历学位认证书》，否则录取资格无效。②具有国家承认的大学本科毕业学历的人员。③获得国家承认的高职高专毕业学历后满2年（毕业后到录取当年入学前，下同）或2年以上的人员，以及国家承认学历的本科结业生，符合招生单位根据本单位的培养目标对考生提出的具体学业要求的，按本科毕业同等学力身份报考。④已获硕士、博士研究生学历或学位的人员。在校研究生报考须在报名前征得所在培养单位同意。,[]
研考成考,研究生招生考试,报名篇,问：每年什么时候可以开始报名？答：考生可以关注研招网（https://yz.chsi.com.cn/），以研招网上的公告信息为准。报名分为三个阶段：预报名阶段、正式报名阶段、网上信息确认阶段。注：2024年硕士研究生招生考试的预报名时间为2023年9月24日至9月27日每天9:00—22:00；正式报名时间为2023年10月8日至25日每天9:00—22:00；网上信息确认时间为2023年10月30日至11月4日12:00（首次材料上传开始时间至截止时间，逾期不能上传），审核不通过需要补充材料的截止时间为11月4日16:00。,"['(考生, 关注, 研招网)', '(报名篇, 分为阶段, 正式报名阶段)', '(报名篇, 分为, 网上信息确认阶段)']"
研考成考,研究生招生考试,报名篇,问：报名时候需要提交什么材料吗？答：（1）考生网上确认时应积极配合报考点，根据核验工作要求提交有关补充材料。考生应当按报考点规定配合采集本人图像等相关电子信息。（2）非上海市高校应届本科毕业生：本市户籍考生还需上传本人上海市户口簿图像，非本市户籍考生还需上传本人2023年连续六个月的上海社保缴费成功记录图像。（具体要求参见报考点公告）,[]
研考成考,研究生招生考试,报名篇,问：报考少数民族高层次骨干人才计划需要关注什么信息？答：请考生关注“上海招考热线”网站（www.shmeea.edu.cn）—首页—研考成考—研究生招生考试栏目发布的“20XX年上海市硕士研究生招生考试少数民族高层次骨干人才计划考生报考须知”内信息。网址:https://yz.chsi.com.cn/apply/ggjh/xymsh/index.do注：2023年少干报考研究生备案时间是10月10日—10月24日22:00期间。,"['(报考少数民族高层次骨干人才计划, 需关注, 20XX年上海市硕士研究生招生考试少数民族高层次骨干人才计划考生报考须知)']"
研考成考,研究生招生考试,报名篇,问：少数民族高层次骨干人才计划考生如何报考？备案需要上传哪些材料？答：选择本市各报考点的少数民族高层次骨干考生，请于规定时间将本人身份证（扫描件）、《报考2024年少数民族高层次骨干人才计划硕士研究生考生登记表》（扫描件，加盖生源地省级教育行政部门公章并签字）等材料通过“研招网”上传备案，逾期不再受理。符合条件的考生备案通过后直接选择相应报考点进行报名。具体事项请考生关注“上海招考热线”通知公告。,"['(考生, 需要上传, 身份证扫描件)', '(考生, 上传备案材料至, 研招网)', '(考生, 选择, 报考点)', '(考生, 关注, 上海招考热线网站)']"
研考成考,研究生招生考试,报名篇,问：少数民族高层次骨干人才计划报考材料审核超过3个工作日没有反馈找谁？答：如超过3个工作日未反馈备案结论，可拨打021-35367070（工作日9:00—11:00、13:30—16:00）咨询。,"['(少数民族高层次骨干人才计划, 属于, 研究生招生考试)', '(研究生招生考试, 属于, 研考成考)', '(报名篇, 属于, 研究生招生考试)', '(少数民族高层次骨干人才计划报考材料审核, 咨询电话, 021-35367070)']"
研考成考,研究生招生考试,报名篇,问：考生网上确认提交的材料审核不通过怎么办？答：考生网上确认时应积极配合报考点，根据核验工作要求提交有关补充材料。,"['(网上确认, 包含步骤, 材料审核)', '(报考点, 负责, 核验工作)', '(核验工作, 要求提交, 补充材料)']"
研考成考,研究生招生考试,考试篇,问：准考证如何下载？答：考生应当在考前十天左右，凭网报用户名和密码登录“研招网”自行下载打印《准考证》。《准考证》使用A4幅面白纸打印，正、反两面在使用期间不得涂改或书写。考生凭下载打印的《准考证》及本人有效居民身份证参加初试和复试。,"['(考生, 凭, 网报用户名)', '(考生, 登录, 研招网)', '(考生, 需要, 准考证)', '(考生, 需持, 居民身份证)', '(考生, 参加, 初试)', '(考生, 参加, 复试)', '(考生, 准考证下载时间, 考前十天左右)']"
研考成考,成人高考,结果篇,问：研究生考试成绩什么时候可以查询？答：考生可以关注“上海招考热线”网站（www.shmeea.edu.cn）—首页—研考成考—研究生招生考试栏目发布的“20XX年全国硕士研究生招生考试成绩即将公布”公告信息。注：2023年硕士研究生招生考试成绩于2023年2月21日公布。,"['(研考成考, 下设子栏目, 研究生招生考试栏目)', '(研究生招生考试栏目, 发布, 20XX年全国硕士研究生招生考试成绩即将公布)', '(2023年硕士研究生招生考试成绩, 公布日期, 2023年2月21日)', '(硕士研究生招生考试成绩, 发布于, 上海招考热线网站)']"
研考成考,成人高考,结果篇,问：研究生考试成绩在哪里查询？答：考生可根据各招生单位公布的查询方式查询成绩。,"['(招生单位, 公布, 查询方式)']"
研考成考,成人高考,结果篇,问：对于研究生考试成绩不认可，怎么申请复核？答：考生可在规定时间登录上海市教育考试院“上海招考热线”网站（www.shmeea.edu.cn），点击进入首页“成绩查询”栏目，进行全国统考科目初试成绩复核网上申请（不接受现场申请）。自命题科目成绩复核在各招生单位进行，复核的具体办法请咨询各招生单位或查看相关单位研究生招生主页。注：2023年硕士研究生招生考试成绩复核时间是在2023年2月22日9:00至2月23日16:00进行。,"['(上海教育考试院, 运营, 上海市教育考试院报名网站)', '(上海市教育考试院报名网站, 包含, 成绩查询栏目)', '(成绩查询栏目, 用于, 全国统考科目初试成绩复核申请)', '(自命题科目成绩复核, 处理单位, 招生单位)', '(研究生考试成绩不认可, 需通过, 申请复核)', '(成绩复核, 包含, 全国统考科目初试成绩复核)', '(硕士研究生招生考试成绩复核, 包含, 自命题科目成绩复核)']"
研考成考,成人高考,结果篇,问：研究生考试成绩复核什么时候可以申请？答：考生可以关注“上海招考热线”网站（www.shmeea.edu.cn）—首页—研考成考—研究生招生考试栏目发布的“20XX年全国硕士研究生招生考试成绩即将公布”内的信息。注：2023年研究生考试成绩复核时间是在2023年2月22日9:00至2月23日16:00进行。,"['(研考成考, 包含子栏目, 研究生招生考试栏目)', '(研究生招生考试栏目, 发布, 20XX年全国硕士研究生招生考试成绩即将公布)']"
研考成考,成人高考,结果篇,问：研究生考试往年的成绩能通过考试院查询吗？答：考生仅能在规定时间查询当年考试成绩，历年考试成绩查询请咨询招生单位。,"['(当年考试成绩, 查询渠道, 教育考试院)', '(历年考试成绩, 需咨询, 招生单位)', '(往年成绩, 等同于, 历年考试成绩)']"
