部分,考试类型,问题类型,问答对,筛选后三元组
高考学考,秋考,报名篇,问：20XX年高考大报名时间？答：考生信息采集时间一般是在每年的10月份，报名详细信息以每年上海招考热线发布的公告为准。注：2024年高考大报名信息采集时间是在2023年10月16日至19日，每天的8点-21点。10月20日的8点-16点。,"['(上海招考热线网站, 发布, 高考报名公告)', '(2024年高考大报名信息采集时间, 信息采集时间, 2023年10月16日至19日8点-21点及10月20日8点-16点)', '(2023年10月16日至19日, 信息采集时段, 每天的8点-21点)', '(2024年高考大报名信息采集时间, 额外采集时间, 10月20日8点-16点)']"
高考学考,秋考,报名篇,问：考生今年高三怎么报名参加20XX年高考？答：本市学籍应届高中阶段毕业生〔高中、中等职业技术学校（含中专、职校和技校）〕由学籍所在学校集中组织网上报名（所有应届生都应完成报名信息采集）。请考生/家长主动联系学校。,"['(中等职业学校, 包括, 中专)', '(中等职业学校, 包括, 技校)', '(学籍所在学校, 组织, 网上报名)']"
高考学考,秋考,报名篇,"问：考生是复读生，怎么报名参加20XX年高考？（往届生、返沪生、社会生如何报名？）答：非本市应届高中阶段毕业生（往届生、非本市学籍应届生等）自主登录上海招考热线网站进行报名，按不同类别选择报考所在区：本市户籍外省市就读考生、本市户籍往届生选择户籍所在区；
在职职工选择单位所在区；
非本市户籍考生选择持有的《上海市居住证》所属区。","['(往届生, 属于, 非本市应届高中阶段毕业生)', '(非本市学籍应届生, 属于, 非本市应届高中阶段毕业生)', '(非本市应届高中阶段毕业生, 报名方式, 上海市教育考试院报名网站)', '(非本市应届高中阶段毕业生, 报名参加, 20XX年高考)', '(本市户籍外省市就读考生, 选择, 户口所在区)', '(本市户籍往届生, 选择, 户口所在区)', '(在职职工, 选择, 单位所在区)', '(本市户籍外省市就读考生, 报名参加, 20XX年高考)', '(本市户籍往届生, 报名参加, 上海市20XX年高考)']"
高考学考,秋考,报名篇,问：秋考报名的网址是什么？答：凡符合上海市普通高校考试招生报名条件的考生须在规定时间里通过“上海招考热线”网站（www.shmeea.edu.cn）—首页—考试报名栏目进行网上报名，并根据报名网站的提示和要求如实填写本人报名信息。,[]
高考学考,秋考,报名篇,问：报名完成后如何确定报名是否成功？答：报名成功之后会获得流水号。,"['(高考学考-秋考, 包含, 报名篇)', '(报名成功, 获得, 流水号)']"
高考学考,秋考,报名篇,问：报名时输入信息错误了怎么办？答：网上报名截止前，考生可多次登录系统修改本人报名信息，系统以最后一次填写信息为准。,"['(秋考, 包含, 报名篇)', '(系统, 允许多次修改, 报名信息)', '(报名信息, 修改截止时间, 网上报名截止前)', '(系统, 采用, 最后一次填写信息)']"
高考学考,秋考,报名篇,问：网上报名时间过了后，才发现报考填写的信息错误了怎么办？答：请于报考确认的时候提出修改。在校生联系学校老师，往届生、社会生等联系区招考机构。,"['(在校生, 联系, 在校老师)', '(往届生, 联系, 区考试招生机构)', '(社会生, 联系, 区考试招生机构)', '(报考填写的信息错误, 处理阶段, 报考确认)', '(秋考, 包含, 报名篇)']"
高考学考,秋考,报名篇,问：考生报名成功后，但是家里突然搬家了怎么办？（报名成功后考生的政治面貌、户籍类别、户籍地址、通讯地址等基本信息发生变化怎么办？）答：报名后考生基本信息发生变化需要更正的（如政治面貌、户籍类别、户籍地址、通讯地址等），应及时向学籍所在学校或报名所在区考试招生机构提出书面申请并附相关证明材料。,"['(基本信息, 包含, 政治面貌)', '(基本信息, 包含, 户籍所在地)', '(基本信息, 包含, 通讯地址)', '(考生, 申请更正, 基本信息)', '(考生, 需提交, 书面申请及相关证明材料)', '(书面申请, 需附带, 相关证明材料)', '(学籍所在学校, 处理, 书面申请)', '(区考试招生机构, 处理, 书面申请)']"
高考学考,秋考,报名篇,问：考生基本信息修改安排在什么时间？答：如有信息变更请第一时间与学籍所在学校或区考试招生机构联系。一般有四次信息更正，具体时间段安排以各学校或区考试招生机构公布为准。以下是2024年高考信息修改时间：第一次2024年1月9日（春考后）；第二次2024年3月初（第一次补报名）；第三次2024年4月中上旬（第二次补报名）；第四次2024年6月10日（秋考后）。,"['(考生基本信息修改, 有更正次数, 4次)', '(信息变更, 处理机构, 学籍所在学校或区考试招生机构)', '(信息变更, 处理机构, 学籍所在学校或区考试招生机构)', '(2024年高考信息修改时间, 第一次修改时间, 2024年1月9日)', '(2024年高考信息修改时间, 第二次信息更正时间, 2024年3月初)', '(2024年高考信息修改时间, 包含时间段, 2024年4月中上旬)', '(2024年高考信息修改时间, 第四次更正时间, 2024年6月10日)', '(第一次补报名, 时间, 2024年3月初)', '(2024年4月中上旬, 对应补报名阶段, 第二次补报名)', '(2024年6月10日, 对应阶段, 秋考后)']"
高考学考,秋考,报名篇,问：考生当年中招录取的是中高职贯通/五年一贯制/中本贯通需要报名高考吗？答：需要。中高职教育贯通培养模式试点（中高职贯通）、中等职业教育—应用本科专业贯通培养模式试点（中本贯通）、五年一贯制需办理转入高等学校手续的学生也须根据上海市教育考试院的具体安排办理报名手续。,"['(中高职贯通考生, 需报名, 高考)', '(中本贯通, 必须报名, 高考)', '(五年一贯制学生, 需办理报名手续, 高考)', '(五年一贯制学生, 需办理, 报名手续)', '(上海教育考试院, 规定, 报名手续)']"
高考学考,秋考,报名篇,问：中本贯通需要参加高考吗？答：中本贯通转段需要参加三校生高考。,"['(中本贯通转段, 需要参加, 三校生高考)']"
高考学考,秋考,报名篇,问：中高职贯通、五年一贯制需要参加高考吗？答：中高职贯通转段、五年一贯制转入高等学校的考试由所在学校负责，仅进行高考报名。,"['(中高职贯通转段, 需进行, 高考报名)', '(五年一贯制, 需进行, 高考报名)', '(中高职贯通转段, 负责机构, 所在学校)', '(五年一贯制, 考试负责机构, 所在学校)']"
高考学考,秋考,报名篇,问：体育单招、保送生、英才班需要报名吗？答：保送生（含外语及竞赛保送生、六部委保送录取优秀运动员）、运动训练、武术与民族传统体育专业考生、高水平运动队、西藏高中班、新疆高中班、新疆中职班、西藏中职班学生、英才班等拔尖创新人才选拔录取的考生，也必须办理报名手续取得报名号。,"['(保送生, 包含, 外语及竞赛保送生)', '(运动训练专业考生, 属于, 拔尖创新人才选拔录取的考生)', '(武术与民族传统体育专业考生, 属于, 拔尖创新人才选拔录取的考生)', '(高水平运动队, 属于, 拔尖创新人才选拔录取的考生)', '(西藏高中班学生, 属于, 拔尖创新人才选拔录取的考生)', '(新疆高中班学生, 属于, 拔尖创新人才选拔录取的考生)', '(西藏中职班学生, 属于, 拔尖创新人才选拔录取的考生)', '(英才班, 属于, 拔尖创新人才选拔录取的考生)', '(拔尖创新人才选拔录取的考生, 必须办理, 报名手续)']"
高考学考,秋考,报名篇,问：体育单招、保送生、英才班报名怎么选择相关考试？答：个人信息如实填报，报考考试选择秋考。,[]
高考学考,秋考,报名篇,问：考生目前大一就读，是否可以参加2024年高考报名？（哪些人员不属于报名对象？）答：（1）具有普通高等学历教育资格的高校在校生，或已被普通高校录取并保留入学资格的学生（大学在籍）；（2）高中阶段学校非应届毕业的在校生（高一、高二年级。三校生一、二年级等）；（3）在高中阶段非应届毕业年份以弄虚作假手段报名并违规参加普通高校招生考试（包括全国统考、省级统考和高校单独组织的招生考试）的应届毕业生；（4）因违反国家教育考试规定，被给予暂停参加普通高校招生考试处理且在停考期内的人员；（5）因触犯刑法已被有关部门采取强制措施或正在服刑者，其中，未成年人按相关法律规定执行。,"['(报名对象, 不包括, 普通高等学历教育资格的高校在校生)', '(报名对象, 不包括, 已被普通高校录取并保留入学资格的学生)', '(报名对象, 不包括, 高中阶段学校非应届毕业生)', '(报名对象, 不包括, 弄虚作假报名并违规参加普通高校招生考试的考生)', '(报名对象, 不包括, 违反国家教育考试规定且在停考期内的人员)', '(报名对象, 不包括, 触犯刑法并被采取强制措施或正在服刑者)']"
高考学考,秋考,报名篇,问：考生是上海户口，参加高考有什么条件吗？（本市户籍考生参加高考报名需要哪些条件？）答：本市户籍人员具有本市常住户籍的高中阶段学校毕业生或具有同等学力者（含具有本市常住户籍的非本市高中阶段学校毕业生）。,"['(上海户口, 等同于, 本市常住户口)', '(本市户籍考生, 报名条件, 高级中等教育学校毕业或具有同等学力)', '(本市户籍高考报名条件, 包含, 同等学力者)', '(同等学力者, 包含, 具有本市常住户籍的非本市高中阶段学校毕业生)', '(同等学力者, 必须具有, 本市常住户口)']"
高考学考,秋考,报名篇,问：考生不是上海户口，参加高考有什么条件吗？（非本市户籍考生参加高考报名需要哪些条件？）答：非本市户籍考生需要满足下列条件之一：（1）考生为积分达到标准分值的《上海市居住证》持证人的同住子女，且在本市参加中招或父母一方连续持有《上海市居住证》3年，同时须本市高中阶段学校毕业；（2）考生为《上海市海外人才居住证》留学人员持证人的同住子女，且须本市高中阶段学校毕业；（3）考生为持有效《具有本市户籍留学人员其持外国护照子女享受优惠政策证明》的留学人员其持外国护照子女，且考生须是参加本市中招并具有本市高中阶段完整学习经历的应届毕业生或2023年已列入本市高考报名库的往届毕业生；（4）考生父母双方或一方现属本市常住户籍，考生本人持《上海市居住证》，且考生须是参加本市中招并具有本市高中阶段完整学习经历的应届毕业生或2023年已列入本市高考报名库的往届毕业生；（5）考生父母双方或一方是经市政府合作交流办认定的驻沪机构工作人员，且考生须是参加本市中招并具有本市高中阶段完整学习经历的应届毕业生或2023年已列入本市高考报名库的往届毕业生；（6）考生为在沪定居并持有签发地为上海的《中华人民共和国外国人永久居留身份证》的外国人，且为高中阶段学校毕业生；（7）考生父母双方或一方是在沪博士后科研流动站（工作站）在站人员，且考生为高中阶段学校毕业生；（8）考生属在沪台胞，香港、澳门特别行政区永久居民身份，且为本市高中阶段学校毕业生；（9）考生为梅山、大屯、鲁矿三地上海后方基地单位职工子女，且纳入市教委锁定名单，须参加本市中招且本市高中阶段学校毕业。,"['(非本市户籍考生, 需为同住子女, 上海市海外人才居住证持证人)', '(留学人员持证人, 持有, 上海市海外人才居住证)', '(外国护照子女, 持有效, 具有本市户籍留学人员其持外国护照子女享受优惠政策证明)', '(非本市户籍考生, 父母属于, 本市常住户口)', '(市政府合作交流办, 认定, 驻沪机构工作人员)', '(非本市户籍考生, 父母为, 经市政府合作交流办认定的驻沪机构工作人员)', '(外国人, 持有, 签发地为上海的中华人民共和国外国人永久居留身份证)', '(在沪定居并持有上海签发外国人永久居留身份证的外国人, 需为, 高中阶段学校毕业生)', '(在沪台胞, 需为, 本市高中阶段学校毕业生)', '(香港特别行政区永久居民考生, 需为, 本市高中阶段学校毕业生)', '(梅山, 属于适用地区, 上海后方基地单位职工子女所在地之一)']"
高考学考,秋考,报名篇,"问：2024年在沪报考普通高校条件一览表（秋季统一高考）答：对象：本市户籍考生、本市高中阶段学校毕业生中的应届毕业生；要求：高中阶段学校毕业或具有同等学历；有关证明：身份证，户籍证明；备注：无
对象：本市户籍考生、本市高中阶段学校毕业生中的往届毕业生；要求：高中阶段学校毕业或具有同等学历；有关证明：身份证，户籍证明，毕业证书；备注：无
对象：非本市高中阶段学校毕业生中的应届毕业生；要求：高中阶段学校毕业或具有同等学历；有关证明：身份证，户籍证明，学籍所在学校证明；备注：无
对象：非本市高中阶段学校毕业生中的往届毕业生；要求：高中阶段学校毕业或具有同等学历；有关证明：身份证，户籍证明，毕业证书；备注：无
对象：驻外使领馆工作人员随任子女中的应届毕业生；要求：高中阶段学校毕业或具有同等学历；有关证明：驻外使领馆出具回国证明，加盖使领馆印章；国外学校证明（译文版），本人常住户口登记卡；备注：无
对象：驻外使领馆工作人员随任子女中的往届毕业生；要求：高中阶段学校毕业或具有同等学历；有关证明：持证人上海市居住证及积分通知单，持证人与考生的身份证；备注：无
对象：非本市户籍考生，持积分达到标准分值的《上海市居住证》人员子女中的应届毕业生；要求：本市高中阶段学校毕业，且参加本市中招或父母一方连续持有《上海市居住证》3年；有关证明：持证人上海市居住证及积分通知单，持证人与考生的身份证；备注：无
对象：非本市户籍考生，持积分达到标准分值的《上海市居住证》人员子女中的往届毕业生；要求：本市高中阶段学校毕业，且参加本市中招或父母一方连续持有《上海市居住证》3年；有关证明：持证人上海市居住证及积分通知单，持证人与考生的身份证，毕业证书；备注：无
对象：非本市户籍考生，持《上海市海外人才居住证》留学人员的子女中的应届毕业生；要求：本市高中阶段学校毕业；有关证明：无；备注：市外国专家局锁定名单
对象：非本市户籍考生，持《上海市海外人才居住证》留学人员的子女中的往届毕业生；要求：本市高中阶段学校毕业；有关证明：无；备注：无
对象：非本市户籍考生，持有效《具有本市户籍留学人员其持外国护照子女享受优惠政策证明》的留学人员其持外国护照子女中的应届毕业生；要求：参加本市中招且具有本市高中阶段完整学习经历；有关证明：市人力资源社会保障局出具的《具有本市户籍留学人员其持外国护照子女享受优惠政策证明》；备注：无
对象：非本市户籍考生，持有效《具有本市户籍留学人员其持外国护照子女享受优惠政策证明》的留学人员其持外国护照子女中的往届毕业生；要求：2023年列入本市高考报名库；有关证明：市人力资源社会保障局出具的《具有本市户籍留学人员其持外国护照子女享受优惠政策证明》；备注：无
对象：非本市户籍考生，父母双方或一方现属上海市常住户籍中的应届毕业生；要求：参加本市中招且具有本市高中阶段完整学习经历；有关证明：父母一方现属本市户口的户籍证明，本人《上海市居住证》；备注：无
对象：非本市户籍考生，父母双方或一方现属上海市常住户籍中的往届毕业生；要求：2023年列入本市高考报名库；有关证明：父母一方现属本市户口的户籍证明，本人《上海市居住证》；备注：无
对象：非本市户籍考生，父母双方或一方是经上海市人民政府合作交流办公室认定的驻沪机构工作人员中的应届毕业生；要求：参加本市中招且具有本市高中阶段完整学习经历；有关证明：无；备注：名单由市教育考试院下达给各区
对象：非本市户籍考生，父母双方或一方是经上海市人民政府合作交流办公室认定的驻沪机构工作人员中的往届毕业生；要求：2023年列入本市高考报名库；有关证明：无；备注：名单由市教育考试院下达给各区
对象：非本市户籍考生，在沪台湾同胞，香港、澳门特别行政区永久居民中的应届毕业生；要求：本市高中阶段学校毕业；有关证明：台湾：《台湾居民来往大陆通行证》（台胞证）；香港、澳门：永久性居民身份证和《港澳居民来往内地通行证》；备注：无
对象：非本市户籍考生，在沪台湾同胞，香港、澳门特别行政区永久居民中的往届毕业生；要求：本市高中阶段学校毕业；有关证明：台湾：《台湾居民来往大陆通行证》（台胞证）；香港、澳门：永久性居民身份证和《港澳居民来往内地通行证》；备注：无
对象：非本市户籍考生，在沪定居并持有签发地为上海的《中华人民共和国外国人永久居留身份证》的外国人中的应届毕业生；要求：高中阶段学校毕业；有关证明：签发地为上海的《中华人民共和国外国人永久居留身份证》；备注：无
对象：非本市户籍考生，在沪定居并持有签发地为上海的《中华人民共和国外国人永久居留身份证》的外国人中的往届毕业生；要求：高中阶段学校毕业；有关证明：签发地为上海的《中华人民共和国外国人永久居留身份证》；备注：无
对象：非本市户籍考生，父母双方或一方是本市博士后科研流动站或工作站在站人员中的应届毕业生；要求：高中阶段学校毕业；有关证明：市人力资源社会保障局证明；备注：无
对象：非本市户籍考生，父母双方或一方是本市博士后科研流动站或工作站在站人员中的往届毕业生；要求：高中阶段学校毕业；有关证明：市人力资源社会保障局证明；备注：无
对象：非本市户籍考生，梅山、大屯、鲁矿三地上海后方基地单位职工子女中的应届毕业生；要求：参加本市中招且具有本市高中阶段完整学习经历；有关证明：无；备注：市教委锁定学生名单
对象：非本市户籍考生，梅山、大屯、鲁矿三地上海后方基地单位职工子女中的往届毕业生；要求：参加本市中招且具有本市高中阶段完整学习经历；有关证明：无；备注：市教委锁定学生名单","['(2024年, 适用年份, 秋季统一高考)']"
高考学考,秋考,报名篇,问：非本市户籍往届考生，父母双方或一方现属上海市常住户籍，参加本市中招且具有本市高中阶段完整学习经历。考生于2022年参加高考，未前往录取学校报到。2023年没有参加高考在复读2024年是否可以参与高考？答：不可以。考生父母双方或一方现属上海市常住户籍，考生本人持《上海市居住证》，且考生须是参加本市中招并具有本市高中阶段完整学习经历的应届毕业生或2023年已列入本市高考报名库的往届毕业生。,"['(非本市户籍往届考生, 父母一方或双方现属, 上海市常住户籍)', '(非本市户籍往届考生, 参加, 本市中招)', '(非本市户籍往届考生, 具有, 本市高中阶段完整学习经历)', '(非本市户籍往届考生, 未前往报到, 录取院校)', '(非本市户籍往届考生, 未被列入, 2023年高考报名库)', '(父母一方现属上海市常住户籍的非本市户籍往届考生, 需持有, 上海市居住证)', '(非本市户籍往届考生, 必须属于, 2023年已列入本市高考报名库的往届毕业生)']"
高考学考,秋考,报名篇,问：梅山、大屯、鲁矿三地高中考生是否也可以参加上海的高考？答：梅山、大屯、鲁矿三地上海后方基地单位职工子女，且纳入市教委锁定名单，须参加本市中招且本市高中阶段学校毕业。,"['(上海后方基地单位职工子女, 需符合条件, 市教委锁定名单)', '(纳入市教委锁定名单的上海后方基地单位职工子女, 须参加, 本市中招)', '(上海后方基地单位职工子女, 需毕业于, 本市高中阶段学校)', '(上海后方基地单位职工子女, 符合条件可参加, 上海的高考)']"
高考学考,秋考,报名篇,问：台湾同胞，香港、澳门华侨考生高考考卷是否比上海高考考卷容易？答：该考试是“普通高校联合招收华侨港澳台学生入学考试”，并非上海秋考。详情请咨询广东省考试院（专线电话020-62833628），上海设立考点。,"['(普通高校联合招收华侨港澳台考试, 非, 上海秋考)', '(广东省考试院, 专线电话, 020-62833628)', '(上海, 设立, 华侨港澳台联考考点)', '(华侨港澳台考生, 参加, 普通高校联合招收华侨港澳台考试)', '(香港考生, 参加, 普通高校联合招收华侨港澳台考试)', '(澳门华侨考生, 参加, 普通高校联合招收华侨港澳台考试)', '(华侨港澳台考生, 参加, 普通高校联合招收华侨港澳台考试)', '(华侨港澳台学生高考考卷, 属于, 普通高校联合招收华侨港澳台考试)']"
高考学考,秋考,报名篇,问：考生是高三应届毕业生，可以报考哪些考试项目？（本市学籍应届高中毕业生可以报考哪些考试项目？）答：符合报名条件的本市学籍应届高中毕业生可以报考春季考试、1月份外语考试、专科自主招生考试、秋季统一高考（含艺术类统一考试、体育类统一考试）。,"['(本市应届高中毕业生, 可报考, 春季考试)', '(本市应届高中毕业生, 可报考, 1月份外语科目考试)', '(本市应届高中毕业生, 可报考, 专科自主招生考试)', '(本市应届高中毕业生, 可报考, 秋季统一高考)', '(秋季统一高考, 包含, 艺术类统考)', '(秋季统一高考, 包含, 体育类专业统考)']"
高考学考,秋考,报名篇,问：考生2023年高考失利，复读中，准备参加2024年高考，是所有的考试都可以报名吗？（符合报名条件的往届高中阶段学校毕业生可以报考哪些考试项目？）答：符合报名条件的往届高中阶段毕业生可以报考：春季考试、1月份外语考试、专科自主招生考试、秋季统一高考（含艺术类统一考试、体育类统一考试）。,"['(符合报名条件的往届高中阶段学校毕业生, 可报考, 春季考试)', '(符合报名条件的往届高中阶段学校毕业生, 可报考, 1月份外语科目考试)', '(符合报名条件的往届高中阶段学校毕业生, 可报考, 专科自主招生考试)', '(符合报名条件的往届高中阶段学校毕业生, 可报考, 秋季统一高考)', '(秋季统一高考, 包含, 艺术类统考)', '(秋季统一高考, 包含, 体育类专业统考)']"
高考学考,秋考,报名篇,问：考生是上海户籍，但是人在外省市读高中，回上海可以参加哪些考试项目？（符合报名条件但非本市学籍应届高中阶段毕业生可以报考哪些考试项目？）答：符合报名条件但非本市学籍应届高中阶段毕业生可报考：春季考试、1月份外语考试、专科自主招生考试、秋季统一高考（含本市艺体类专业统一考试）。,"['(考生, 户籍地, 上海)', '(考生, 符合条件, 符合报名条件但非本市学籍应届高中阶段毕业生)', '(符合报名条件但非本市学籍应届高中阶段毕业生, 可报考, 春季考试)', '(符合报名条件但非本市学籍应届高中阶段毕业生, 可报考, 1月份外语科目考试)', '(符合报名条件但非本市学籍应届高中阶段毕业生, 可报考, 专科自主招生考试)', '(符合报名条件但非本市学籍应届高中阶段毕业生, 可报考, 秋季统一高考)', '(秋季统一高考, 包含, 艺体类专业统考)']"
